{
  "mandate_id": "mdt_foundation_1",
  "principal": {
    "actor_id": "https://company.example.com/actors/owner"
  },
  "delegatee": {
    "actor_id": "https://agents.example.com/actors/buyer"
  },
  "action": {
    "verb": "purchase",
    "target": "service:cloud-compute",
    "arguments": {
      "max_amount": "250.00",
      "currency": "USD"
    }
  },
  "expires_at": "2026-04-30T23:59:59Z"
}
